<?xml version="1.0" encoding="UTF-8"?>
<!DOCTYPE menu SYSTEM "foodex-catalog.dtd">
<menu>
  <item id="M001">
    <name>Chicken Biryani</name>
    <category>Biryani</category>
    <restaurant>Spice Garden</restaurant>
    <price>300</price>
  </item>
  <item id="M002">
    <name>Margherita Pizza</name>
    <category>Pizza</category>
    <restaurant>Pizza Zone</restaurant>
    <price>400</price>
  </item>
  <item id="M003">
    <name>Classic Chicken Burger</name>
    <category>Burgers</category>
    <restaurant>The Burger House</restaurant>
    <price>200</price>
  </item>
</menu>